584,c9lwiat,"A string walks into a bar and the bar tender says :"" hey get out of here we don't like your kind around here"". So the string messes up his hair and ties himself in a knot and walks back in to the bar. The bartender says : ""hey aren't you that string from earlier?""  the string replies :""No, I'm a frayed knot"". and another one: a couple of guys walk into a bar with jumper cables, the bar tender says: ""hey you two, you better not start sh!+ up in here"""
585,c9lwn3g,"So I told my girlfriend I wanted to fuck her between the tits, and she says ""How you gonna make that feel good for me?"", and I said ""Right before I cum, I'll stop punching you in the face.""

-Doug Stanhope"
586,c9lwoga,"An old married couple are sitting on the couch when the man asks the woman, ""why have you never given me head?""  

The woman hesitates a little and responds ""well, I just didn't think you'd respect me anymore after I did something like that.""

The old man, laughs a little and says, ""honey we've been together for 50 years, I'd never think less of you for doing something I liked.  I love you and there's nothing you can do to make think bad of you.  You are my angel.""

She smiled and responded to his earnest appeal by pulling down his pants and blowing him.

A few minutes after she was finished the phone rang and the old man answered it and the caller asked for her.  He yelled ""hey cocksucker, it's for you!"""
587,c9lwrbn,[deleted]
588,c9lww1x,"What do you call an event where everybody except two people are thinking of food and the two exceptions are thinking about sex?

A wedding"
589,c9lwwr3,"A guy walks into a bar at the top of a tall building just in time to see a man do a shot, run the length of the bar and jump out the window. 'Holy shit!' exclaims the guy and runs over to the window to look down in the street below, but he can't see anything there...
A few minutes later the man runs back into the bar shouting 'Ta dah!'. The guy is baffled as to how this man can do a trick like that so asks him how he did it... 'Oh well its easy! You just do a shot of this special liqour, run the length of the bar, jump out the window and you land on the ground soft as a feather. Give it a try, it works every time!'
The guy is clearly dubious so the man offers to do the trick again... he downs a shot, runs the length of the bar, jumps out the window and a few minutes later turns up back in the bar safe and sound...
The guy's curiosity gets the better of him, so orders the shot, downs it, runs the length of the bar, jumps out the window and **SPLAT!!** he hits the ground and is killed instantly.
The bartender turns to the man and says, ""Superman, you're a asshole when you're drunk..."""
590,c9lwyau,"George Bush goes to Afghanistan to have a peace talk with Osama Bin Laden. When Bush sits down, he notices 3 buttons on Osama's chair. He disregards this and begins to talk with Osama. Osama presses the first button, and a glove pops out and punches Bush in the face. Bush ignores this and continues talking. Then, with a snicker, Osama presses the second button and a shoe kickes Bush in the shin. Not wanting to put off peace, Bush continues talking. Finally, Osama presses the third button while laughing, and another shoe kicks Bush in the groin. Bush gets fed up, and left with ""We'll finish this talk later!""

A few days later, Osama flies to Guantanamo Bay to talk with Bush. As Osama sits down, he sees 3 buttons on Bush's chair and prepares himself for Bush's revenge. While they're talking, Bush presses the first button, Osama ducks, but nothing happens. Bush snickers and continues. After a while, Bush presses the second button and Osama jerks up his feet. Nothing happens again, and Bush continues after a few laughs. Finally, Bush presses the third button and Osama leaps out of his chair. Nothing happens. Now Bush is roaring with laughter, and kind of freaks Osama out. Osama moves toward the door and says ""Screw this! I'm going back to Afghanistan!""

And through his laughter, Bush says ""What Afghanistan?!"""
591,c9lwzl2,"There are two muffins in an oven, sitting, getting baked. One muffin says to the other, ""Man, it's hot in here.""  The other muffin replies, ""Holy shit! A talking muffin!"""
592,c9lx3og,"I love this one! It's one of Dave Chappelle's jokes.
http://www.youtube.com/watch?v=32OX1E59nA8"
593,c9lx441,"Two cannibals are eating clown, on turns to the other and says...""Does this meat taste funny to you?"" "
594,c9lx4jy,"There's a grandmother and her grandson on the front porch smoking cigarettes on a rainy day.

The grandmother asks him, ""What is that on your cigarette?"" He replies, ""Oh, this is just a condom to keep the rain off of it.""

The next day the grandmother is at a gas station and the clerk says, ""Do you need any help finding anything?"" 

She replies, ""Yea, I'm looking for some condoms."" 

He says, ""OK, do you know what kind?""

She replies, ""One that can fit a camel."""
595,c9lxaog,"A Jew and a Roman Catholic were arguing about the relative merits of their respective religions.

The Jew asked: “Tell me my son, when a man [naturally] enters the Roman Catholic church, what does he become?”

The Roman Catholic proudly answers: “When a man enters the Roman Catholic church he becomes a priest”. He pauses for effect. “He has a parish and a flock of the faithful, he has complete responsibility for their lives and their religious welfare. The priest has an immense responsibility for ensuring that his flock and their offspring all successfully enter Heaven at the end of their lives. The role of the priest is crucial to the understanding and the practise of the Roman Catholic faith.” The Roman Catholic thinks to himself that no one could possibly argue with that.

The Jew replies, “Priest, shmeest, small potatoes, is there nothing more?”

The Roman Catholic becomes a little agitated and begins somewhat tersely, “Look, if you are an immensely holy man and are looked on benignly by the Almighty, you may become a bishop.” He pauses for effect. “As a bishop you have a diocese, you have many priests and parishes to administer and the strains and demands are exceptional, but you draw your strength from the Almighty and He sustains you.” The Roman Catholic utters these last words with emphasis.

The Jew is not impressed. “Bishop, schishop, pointy hat, they are four to the dime. Nothing else?

The Roman Catholic is becoming enraged. “Look,” he says loudly, “if you have pushed the boundaries of holiness to their limits, and for all your life you have honored and worshipped Our Blessed Saviour with every breath that you have ever taken, then you may be made a Cardinal and be called to the Holy City of the Vatican where your role will be only slightly lower than the very Hosts of Heaven!” The Roman Catholic is exhausted, but satisfied that he has won.

The Jew replies, “Cardinal, yes, nice red hat, nice red frock, nice piece of income for not doing a lot. But is that it?

The Roman Catholic is approaching a heart attack, but he continues to drive on. “Listen to me, listen to me! If you are beyond holiness itself, and if you are a man in one-two-thousand-million and you hear the voice of God Almighty from when you awake in the morning to when you rest your head at night, and also your soul is more pure than starlight, you may stand a chance of becoming POPE!” The Roman Catholic slumps exhausted.

The Jew says, “Yes, pope, shmope, yes he has a nice line ‘Urbi et Orbi’. ‘to the city and to the world’ which he says on that balcony of that very nice house that he has. But is that all?

The Roman Catholic crosses the line to mental derangement. “ What the fuck to you want”, he screams, “Jesus Fucking Christ?”

The Jew replies softly, “One of our boys made it.”






"
596,c9lxcnc,"Why did the chicken cross the road? 
To get to the Pedophile's house.
Knock Knock,
""Who's there""
the chicken"
597,c9lxd8o,"Why did Princess Diana cross the road?


The Conservation of momentum."
598,c9lxedd,"A teenage girl goes to the living room where her dad sits on the couch and watches TV.

She asks ""Dad, can I borrow the car?""

""Only if you give me a blowjob"" he replies.

Disgusted, she storms out of the room. She thinks ""But I really need the car"" and couple of minutes later, she goes back and tells her dad ""Ok, I'll do it.""

While sucking his dick, she then exclaims ""Ughh ! Dad, your dick tastes like shit !""

Her dad : ""Well, your brother already needed the car this morning"""
599,c9lxhpv,"A bear and a rabbit are on either side of a tree shitting in the woods. The bear turns to the rabbit and says ""Do you have problems with shit sticking to your fur?"" Rabbit replies, ""no"". So, the bear wipes his ass with the rabbit."
600,c9lxlbg,"So there's this guy crawling through a desert, right, and a sees this snake sitting next to this lever..."
601,c9lxmp6,"What does Cinderrella says when she gets to the ball?
Ahck!!!!
Anybody get it?"
602,c9lxr37,"A man was visiting his Chinese friend in the hospital and his friend said something in Chinese and then died. The man didn't understand Chinese, so at the funeral he said to the crowd ""I'll never forget his last words to me before he died."" He then repeated phonetically what his friend had said and asked ""by the way, what does it mean in English?"" There was a moment of silence and then a family member said ""it means 'you're standing on my oxygen tube.'"""
603,c9lxyww,How does a guy know he has a high sperm count? When she has to chew before she can swallow.
604,c9lxzge,"Mickey and Minnie Mouse were in divorce court when the judge asked Mickey, ""You said you were divorcing her because she is crazy right?"" Mickey replied, ""Hell no I'm divorcing her because she is fuckin Goofy."
605,c9ly04z,"A man had been married to his wife for 35 years and he was beginning to suffer from erectile dysfunction.  It began to make him miserable, so he rushed to his doctor to ask for help.

The doctor suggests medication but the man is unwilling to suffer the psychological consequences that are often related.  The doctor then begins to explain a new break-through surgery.

""We can take the muscles from the base of a baby elephant's trunk,"" the doctor began to explain, ""and implant them at the base of your penis.  The operation is relatively new, but it has shown great success in trial studies.""

""I'll try anything doc!"" the man exclaimed.

After a successful out patient procedure, the man had a quick recovery and decided to take his wife out to the fanciest restaurant in town to celebrate.  The couple was having fun, laughing.  The man began to feel his confidence returning.  He couldn't wait to take his wife home and ravage her.  Suddenly, unexpectedly, the man's penis emerges from underneath the table cloth, grabs a dinner roll out of a basket on the table, and slowly slinks back from whence it came.

The man's wife immediately begins to smile and blush as she says, ""Oh my god sweetie!  That was amazing!  Can you do it again?!""

The man leans forward onto the table.  Tears are streaming down his face as he looks his wife square in the eyes.  He says, ""Yeah, sweetheart, I think I can.  But, I'm not sure if I can fit another dinner roll up my ass."""
606,c9ly29f,"my two favorite (it won me a bar bet to see who can make the bartender laugh the most)

What do you call a black pilot?

....a pilot you racist


and then

What does Dale Earnheardt and Pink Floyd have in common?
Their last big hit was the wall."
607,c9ly2hg,How do you circumsize a redneck?????? Kick his sister in the jaw.
608,c9ly2jt,"A Jew and a Roman Catholic were arguing about the relative merits of their respective religions.

The Jew asked: “Tell me my son, when a man [naturally] enters the Roman Catholic church, what does he become?”

The Roman Catholic proudly answers: “When a man enters the Roman Catholic church he becomes a priest”. He pauses for effect. “He has a parish and a flock of the faithful, he has complete responsibility for their lives and their religious welfare. The priest has an immense responsibility for ensuring that his flock and their offspring all successfully enter Heaven at the end of their lives. The role of the priest is crucial to the understanding and the practise of the Roman Catholic faith.” The Roman Catholic thinks to himself that no one could possibly argue with that.

The Jew replies, “Priest, shmeest, small potatoes, is there nothing more?”

The Roman Catholic becomes a little agitated and begins somewhat tersely, “Look, if you are an immensely holy man and are looked on benignly by the Almighty, you may become a bishop.” He pauses for effect. “As a bishop you have a diocese, you have many priests and parishes to administer and the strains and demands are exceptional, but you draw your strength from the Almighty and He sustains you.” The Roman Catholic utters these last words with emphasis.

The Jew is not impressed. “Bishop, schishop, pointy hat, they are four to the dime. Nothing else?

The Roman Catholic is becoming enraged. “Look,” he says loudly, “if you have pushed the boundaries of holiness to their limits, and for all your life you have honored and worshipped Our Blessed Saviour with every breath that you have ever taken, then you may be made a Cardinal and be called to the Holy City of the Vatican where your role will be only slightly lower than the very Hosts of Heaven!” The Roman Catholic is exhausted, but satisfied that he has won.

The Jew replies, “Cardinal, yes, nice red hat, nice red frock, nice piece of income for not doing a lot. But is that it?

The Roman Catholic is approaching a heart attack, but he continues to drive on. “Listen to me, listen to me! If you are beyond holiness itself, and if you are a man in one-two-thousand-million and you hear the voice of God Almighty from when you awake in the morning to when you rest your head at night, and also your soul is more pure than starlight, you may stand a chance of becoming POPE!” The Roman Catholic slumps exhausted.

The Jew says, “Yes, pope, shmope, yes he has a nice line ‘Urbi et Orbi’. ‘to the city and to the world’ which he says on that balcony of that very nice house that he has. But is that all?

The Roman Catholic crosses the line to mental derangement. “ What the fuck to you want”, he screams, “Jesus Fucking Christ?”

The Jew replies softly, “One of our boys made it.”






"
609,c9ly35z,Did you hear about the Cow who was caught for insurance fraud ? Apparently he was milking his injuries .. 
610,c9lybx1,France. 
611,c9lyffl,"So a Russian man, an English man, and a Chinese man all decided that they are going to go to a mountain and mine for gold. The Englishman tells the other one that he will get the dynamite, the Russian man will get the shovels, and the Chinese man should get the supplies. The English man and the Russian man go to the mountain and mine a bunch of gold. When they are walking back into the town the Chinese man jumps out of the bushes and shouts, ""SUPPLIES!!!"""
612,c9lym3n,"Post it before but its funny. Guy walks into a bar with his pet octopus and a stack of $100's. He announces an open bet that if anyone can produce an instrument that his octopus can't play then he will gladly give them all his money. ""If he can play it you owe me $100."", he says. Seeing as the stack of money is fairly large he finds several takers. First is a man with a guitar. The octopus takes the guitar looks it over very closely, examines it a bit more, then begins to play. And plays wonderfully, Jimmi Hendricks would be proud. The challenger admits defeat and pays his $100. Second is a man with a trumpet. The octopus takes the trumpet, examines it a minute, then begins to play. And he can play, Satchmo was smiling from the afterlife. The second challenger admits his defeat an pays his $100. The bartender reaches under his bar and pulls out a set of bagpipes. ""I knew these would be useful one day, bet ya never seen any of these."", says the bartender. The octopus does actually look surprised. He takes the bagpipes, looks them over very closely, examines them a bit more, flips it to the side and looks even closer. After a minute the owner begins to get a little nervous, ""Hey, you better start playing that quick or we're gonna lose all our money."" The octopus still perplexed by the bagpipes says, ""Play it? As soon as I find out how to get these pajamas off I'm gonna fuck the shit out of it!"
613,c9lypdy,"My favorite is the story of the Olympian with AIDS. 

A man and woman are on a couch making out. Things start to get heated and the woman takes off his shirt, revealing a Nike tattoo. The woman stops and asks why he has a Nike tattoo, and the man replies 'well, I ran in the Olympics in 2004 and Nike sponsored me, so I got a tattoo for it."" she nods her head and continues. 

A few moments later, he takes off his pants and reveals a reebok tattoo on his thigh. Again, she asks about it and he replies that it was his sponsorship in 2008. Again, they continue. 

Finally things get really heated and she takes off his underwear. Immediately she lets out a loud gasp and stops. He replies ""WAIT, GIVE IT A MINUTE! it'll say Adidas."" "
614,c9lypm3,What was the baby seal's favorite drink?  Canadian club on the rocks.
615,c9lyrlq,"I read this one a reddit a while back, and it has since become my go-to:
Two guys are sitting at the bar, and one guy asks the other, ""do you ever fuck your wife in the other hole?""  His friend responds, ""no way, man!  I could get her pregnant!"""
616,c9lyrt0,"Three prostitutes are sitting at a bar talking about which one of them has the loosest pussy. The first one take a glass and sticks it up there with a very pleased look on her face. The second woman take a handle of alcohol from begind the bar, gets the whole thing in and says to the first girl ""i am obviously the loosest"" the two girls look over to the third  prostitute to see if she could be it. To their surprise, she had already slid half way down her bar stool.

or 


3 vampires walk into a bar. the first orders the usual, a pint of blood. The second vampire follows suit also ordering a pint of blood. The third vampire orders a mug of hot water and the othrer two vampires look at him very confused and ask why he only got water? The third vampire pulls out a used tampon and say ""Im making tea!"""
617,c9lyskl,"Whats the difference between a greyhound bus & a crab with big boobs?

Ones a busty crustacean and ones a crusty bus station"
618,c9lyxeq,"So there's this bar with an enchanted / cursed mirror over in the corner. You have to stare at your own reflection and speak a statement, which if true, grants you whatever you wish; but if the statement is false, you immediately vanish in a puff of smoke and are never seen again.

A blonde, a brunette and a redhead decide to try their luck. After all of them down a few drinks to work up the nerve, the brunette goes first. She stares right into the mirror at her own reflection and says, ""I think I'm the most beautiful woman in this bar.""

POOF! She disappears.

The redhead goes next. She stares right into the mirror at her own reflection and says, ""I think I'm the most intelligent woman in this bar.""

POOF! She disappears.

The blonde goes next. She stares right into the mirror at her own reflection and says, ""I think--"" 

POOF! She disappears.
"
619,c9lyya0,"- Dad, why my sister's name is Honey?
- Oh well, you see kiddo... That's what your mom kept saying when we made love.
- Oh dad, that's romantic!
- Indeed it is, Thatsmyanus"
620,c9lz1nr,"From Louis C.k.

""Why does Pinocchio lie?"" - 
""Because he's a fucking liar!"""
621,c9lz29n,"Why should you never run over a black kid on a bike?

It might be your bike. "
622,c9lzgpi,"Two sveedish men vent on a fishing trip out on the lake, yah? And you know how da Sveedish are very practical people, yah? So, anyway. Sven leaned a little too much and da boat tipped over, putting both Sven and Dooda in de water. Sven survived but Dooda drowned. So Sven had to tell Dooda'a wife Hilda da bad news. He thought real hard when he got to Dooda's door, knocked, and when Hilda opened da door Sven started to sing, ""Guess who died in the lake today, Dooda, Dooda."" Hilda said ok and closed da door. 
Da next day Hilda went down to the cemetery to have a gravestone made for her late husband. She asks the gravestone maker how much a stone is to get engraved. The man said, ""Da first 5 words are free, after dat $3 per word.""
Hilda said, ""Ok. Put dis on the stone: 'Dooda died'.""
To which the man replied, ""You still have 3 more free words if you want them.""
Hilda said, ""Ok,"" thought for a while, and said, ""Ok put dis: 'Dooda died. Boat for sale.""
"
623,c9lzmhj,"Knock Knock.  ________
I eat mop.  __________  Fuckin gross dude.
"
624,c9lzmn9,How do you know its bedtime in Michael Jacksons house? The big hand covers the little hand.
625,c9lznre,Did you hear about the Irish terrorist who tried to blow up a car? He burnt his lips on the exhaust pipe
626,c9lzpcp,First thing that I thought of when I saw this was the bathysphere.
627,c9lzurg,"What's Mexico's favorite sport?

*cross country*"
628,c9lzxi8,"A Jewish guy, a colored guy, and a Mexican all walk into a bar. The bartender looks at them and says get the fuck out. - Gran Torino "
629,c9lzybm,"Elderly Welsh couple are waiting in their home to be taken to a care home, since they aren't capable of looking after themselves any more.

""Myfanwy,"" says the man, ""I 'ave a connfession to make. I'm dreadfully sorry that I was unfaithful to you when I was a younger man. Twice, it was, with two different women - Edith at the Post Office and Lilian down the pub. But I've never stopped loving you.""

""Bless you, Dai, I've known about them all the time.""

""You have? And you never said anything. You are the best wife a man could want.""

""No, I never said anything. But I have something I must say to you now. I was unfaithful to you, at about the same time you were unfaithful to me.""

""You were unfaithful to me?""

""Yes, Dai. Once with Swansea Town football team and once with the Rhondda Valley Male Voice Choir."""
630,c9lzyh2,Wenn ist das Nunstück git und Slotermeyer? Ja! Beiherhund das Oder die Flipperwaldt gersput!
631,c9lzz52,The ones I know are in spanish :(
632,c9m00jj,"An old lady wants to get her husband to bang her one more time, she asks her friends at bingo what to do...they tell her to wait for him to come home from work, and when he's in the shower to get naked on the bed and put your legs behind your head, when he comes out he won't be able to resist.

So her husband comes home and hops in the shower, she gets naked, jumps on the bed and puts her legs behind her head.......her husband gets out of the shower, looks down and says ""JESUS CHRIST WOMAN...COMB YOUR HAIR AND PUT YOUR TEETH BACK IN, YOU LOOK LIKE SHIT!""
"
633,c9m00oy,"A ten year old boy is sleeping, when he is awaken by the sounds of moaning and grunting. He opens the door to his parents room and sees them fucking. The parents quickly stop. He asks, ""What were you doing?"", and the dad says, ""helping your mom with her bad back"". 10 minutes later, his parents hear moaning and grunting. The dad gets out of bed to check where the noises are coming from. The dad opens the door to the guest room, to see the boy fucking his grandmother. The boy just looks at his dad and says, ""How do you like it when I fuck your mom?"""
634,c9m04mc,"(Not my best, but I really like it.)

Why was 6 afraid of 7? 7,8,9.

Why is 10 afarid of 11?
HE DOESN'T WANT TO GOOO.

http://goo.gl/BBUI1
"
635,c9m05h0,"Three logicians walk into a bar. The bartender asks all three of them together, ""will you all be having beer?"". The first logician says ""I don't know."". The second says ""I don't know."". The third says ""...yes!""."
636,c9m05li,"Susi the teacher asks the class ""There are 5 birds on the roof, the hunter shoots 2 of them. How many are left on the roof?""
Karl raises his hand, and says ""none, because they were scared of the shot"". Susi smiles and says ""sorry, wrong answer, but i like the way you think."" Karl raises his hand again and asks ""There are two women eating ice cream. Which one is married? The womon who licks her ice or the women who bites her ice? The teacher turns red and after a while she mumbles ""the women licks her ice"". Karl grinns and replies ""Wrong, the women with the ring, but i like the way you think."""
637,c9m08xk,"Why did the little boy drop his ice cream cone? 

Because he was hit by a bus. "
638,c9m0a7q,"""In interviews the employer usually asks me where I see myself in 5 years...I like to tell them I'll be celebrating the 5 year anniversary of this question."" Mitch Hedburg.  we hardly knew ye"
639,c9m0d64,"A blonde is walking along the tow-path of a canal. She notices another blonde walking towards her on the tow-path opposite.

As they draw level with each other, the other blonde shouts across the water.

""Excuse me!"" says the second blonde. ""Can you tell me how to get to the other side?""

""But,"" replies the first blonde, ""you *are* on the other side."""
640,c9m0et3,"So I heard oxygen and magnesium were dating. All I could think was Omg. 

At least gravity is attracted to me... "
641,c9m0ftm,"What's the difference between jam and jelly?
I can't jelly my dick up your ass"
