393,c9m0qn3,"A little boy dresses up as a pirate for halloween. He has a bit of a speech impediment. The first house he goes to he says, ""I'm a birate. This is my barrot. Can I have some bandy?"" The woman looks at him and says, ""My my aren't you cute. But where are your buccaneers?"" The boy looks are her angrily and says ""On the side of my buckin head you buckin dumass."""
394,c9m0tl6,"what's green and fuzzy and kills you when it falls out of a tree?

A pool table."
395,c9m0uxn,"I apologize in advance as I am not the best at telling jokes and I've only heard this joke once about a year ago.

There was a man who had a horse that was constantly in a state of depression. He decided to try and make some money off of it. He put up a sign in town that said he would give $1000 to anyone who could make his horse laugh. But you had to pay $10 to try. So time goes by and the man has made about $3000 and still no one has made the horse laugh. Till one day a man comes and pays the $10. The owner of the horse watches as the man goes over to the horse and whispers something in its ear. The horse proceeds to roll around on the ground laughing hysterically. So the owner reluctantly hands over $1000 and the stranger goes on his way. Well now the horse is always happy and laughs all the time. So the owner changes the sign to anyone that can make the horse cry. Time passes and the man makes about $2000 and still no one has made it cry. One day the same man that made the horse laugh comes back to try and make it cry. The owner watches again as the stranger walks over to the horse and whispers to it. The horse proceeds to burst into tears sobbing uncontrollably. The owner again hands the man $1000 and says, ""I made $5000 and you won $2000 dollars of it. How did you make my horse laugh?"" The stranger replied, ""I told him my penis was bigger than his."" The owner then asked, ""And how did you make it cry?"" The stranger answered, ""I showed him."""
396,c9m10dr,"Deaf couple get married. While in their honey moon they turns the lights off before laying in bed. They realize there's no way for them to communicate with each other  while the lights are off. So the next morning husband tells the wife ""we need to figure something out"" wife agrees. So wife tells husband ""how do we let each other know when the other is in the mood?"" Husband reply's ""to let you know am in the mood ill squeeze one of your breast 3 times, 1 time when am not in the mood"" Wife agrees. The husband reply's ""when your in the mood stroke me 3 time"" wife agrees & reply's ""how do I let you know am not in the mood?"" So the husband reply's "" when your not in the mood, stroke me 75 times"""
397,c9m10yu,"Why did Sarah fall off the swing? 

Because she had no arms. 

Knock knock! 

Who's there? 

Not Sarah."
398,c9m12cq,"In every group there's a swinging dick Quagmire type fucker, lets call him Earl. One day Earls buddies ask, ""how do you go all night""? ""Well if you slam your dick up side the dresser 3-4 times it will numb right out and you can beat the bottom out of it."" Eager to try this theory out, Jimbo rushed home snuck into the bedroom without his wife noticing and slammed his dick up side the dresser 3-4 times. ""That you, Earl?"""
399,c9m15pt,"Whats the different between a hare and a rabbit?


You can pull a hare out of your arse but you can't pull a rabbit"
400,c9m165g,"What's a fish's favorite dessert? 

Octopi"
401,c9m1k17,"""Wenn ist das Nunstück git und Slotermeyer? Ja! Beiherhund das Oder die Flipperwaldt gersput!""

Ahahahahaha! **dies*"
402,c9m1l5o,What is the difference between jelly and jam? *I can't jelly my cock down your throat.*
403,c9m1n51,I would like to thank you all for getting me this many upvotes. :) Also for the Jokes.
404,c9m1ono,"What's red and smells like blue paint?

Red paint."
405,c9m1pwv,"A man goes to the doctor. The doctor says, sorry sir it's bad news. 

'What's wrong with me?' says the man

Dr 'Well two things really, first of all you have alzheimers' 

Patient 'Oh my god that's terrible, what's the second thing?!?!'

Dr 'I'm sorry to say sir, you also have cancer'

Patient 'Well...at least I don't have alzheimers'"
406,c9m1rmu,"A solo pilot develops engine problems while over a remote jungle and has to bail out.  He lands and is immediately captured by the local tribe.  They inform him he has trespassed on their land and will be put to death.  However, if he passes the ""Test of the Three Huts"" he will be set free as he has proven himself to be a great man.

The first hut contains the alcohol they have obtained in trade.  He must drink 12 bottles of whiskey within an hour.

The second hut contains a tiger with a rotten tooth.  He must extract the tooth by hand.

The final hut contains a woman who has never been sexually satisfied by any other man.  He must bring her to orgasm.

Given no choice the man agrees to try.  He enters the first hut.  A few minutes later an empty bottle is flung out, followed by another one a few minutes later, and so on, until just under the hour mark the 12th bottle flies out.  The man staggers out of the hut, falls down, picks himself up, and makes it to the second hut.  Seconds later the walls of the hut are shaking from impacts and the air is filled with roars and screams both from the tiger and the man.  Eventually there is silence.  The man staggers out of the second hut.  His clothes are shredded and he is bleeding from claw marks all over his body.  He stares out into the gathered tribesmen and in a mumbling slur says, ""Now wheres thith lady with tha toothache?"""
407,c9m1xa2,"This is so much better in person when you can use a mexican accent

A Mexican was crossing the border into the U.S. and came up to the border patrol.
Officer: Sir, are you a legal U.S. citizen?
Mexican: Yees, aym uh Legal us citisin
Officer: I'm going to need you to give me a sentence containing the words green, pink and yellow.

The Mexican set there for a second then said,
""well, one day I was sitting in my house when I heard my phone go green green green so i pinked it up and said yellow 

kinda lame but it makes me laugh"
408,c9m21fy,A baby seal walks into a club.
409,c9m22kx,"A mom is sitting down when her daughter comes up to her and asks her "" Mommy, why am I called Rose?"" The mother says, "" You're called Rose because when you were a baby, i dropped a Rose on your head."" Then, her other daughter comes and asks "" Mommy, why am i called Lily?"" The mom says,"" You're called Lily because when you were a little baby, i dropped a lily on your head."" Then, her son comes up and says "" Fkfjwpeutpxkfo!"" The mother, annoyed that all of her offspring are bothering her, says, "" Not now, Brick, I'm busy!!"""
410,c9m23ns,"definitely not my own but i remember the joy it got me.

""Why did the little girl fall off the swing?

Because the bitch had no arms.""
 "
411,c9m27bp,"A baby polar bear asks his polar bear mother if his dad is a polar bear.

""Of course he is your father.""

""Are you sure? Are you sure I am not part brown bear or a grizzly? You can tell me.""

""Of course you are a polar bear why would you say such silly things?""

""Because I'm fucking freezing."""
412,c9m2em7,"George was planning on going out with ""The Boys"" when his wife told him that he wasn't leaving the house.
George's Wife: ""The last time you went out with your friends you got so drunk that you puked on your shirt.""
George: ""But Honey, I promise that I wont drink a drop of alcohol all night!""
So after begging his old lady for an hour, George got the OK the go out with the guys as long as he stayed off of the booze.
George met up with the guys at a local bar and proceeded to get shit-faced. After about 3 hours of guzzling liquor, George blew chow all over his shirt.
George: ""Shit! The old lady is going to throw my ass out of the house for getting drunk and puking on my new shirt!""
Bill, George's best pal, gave drunk ass George an idea of how to keep from getting in trouble with the wife.
Bill: ""All you got to do is have a $20 bill in your hand when you walk through the door. Then, when she accuses you of barfing all over yourself, just tell her that some other drunk puked on you and that he gave you 20 bucks to get the shirt cleaned.""
So, when drunk ass George walked into the house with money in hand, his wife was waiting for him in the living room.
Georges wife: ""I knew that your drunk ass would spew bile and booze all over that new shirt!""
George: ""Honey, let me explain! This drunken fool at the bar puked on me and gave me 20 bucks to have it cleaned.""
His wife snatched the money out of his hand and observed that he was holding two $20 bills.
George's wife: ""Is that so? Then where did the other 20 dollar bill come from?""
George: ""Oh, That's from the guy who shit in my pants."""
413,c9m2ess,"what do you tell a woman with two black eyes?
Nothing, you already told her once"
414,c9m2hcm,"Why did the sperm cross the road?

Change the answer depending on the genders of people involved, but basically the answer is, ""Because I put the wrong sock on this morning."""
415,c9m2xx8,"Two men sitting on a park bench watching a dog lick its balls. One guy says to the other ""I wish I could do that"". Other guy replies ""You better pat him first""."
416,c9m2zzj,"Two men, one white and one black ride the bus together every day. Every day the white man sniffs his fingers and whispers ""Mary"", and then smiles. One day, the black man asks the white man what he is doing. The white man says every morning I finger my wife. I dont wash my finger, and smell it on the bus because it reminds me of her. Its a good way to start the day. So, one day the black man decides to do this. He does this to his wife and on the bus, first the white man sniffs his hand, whispers ""Mary"" and smiles, feeling content. Then the black man sniffs his entire arm from fingertips to shoulder and whispers jaaaaakooouuuummmbbbaaa"
417,c9m325s,"A miner works up in the hills for 6 years without seeing a single human being. 
He goes down to the tavern in the far away town and drinks heavily. He asks the bartender "" do you have any women for my amusment?"" And the bartender says "" um, no sir but we do have this asain guy you can fuck."" The miner gets pissed and says "" hey man I don't play that shit."" And storms away back up to the mountain. a few years later he comes back, get's black out drunk and asks the bartender the same question, to which he replies ""no sir, but like i've said before we have this asain guy you can fuck."" Furious the man yells "" i've already told you I don't play that shit!"" 
He goes back up to the mountain.
He comes back again a few weeks later and gets flat out smashed. He asked the bartender the same question to which the bartender replied with the same answer. 
So the miner, tired and drunk says. "" alright ill do it, but how many people will know?"" 
""five people"" 
""FIVE people, wtf man, why?"" 
"" well  me, you, the asain, and the two men holding down the asain goes he doesn't play that shit either. "" "
418,c9m379b,"I heard this on Reddit a while back. 

""I have a bunch of rape whistles...
I don't like to use them or anything,
they're just souvenirs. """
419,c9m3b3c,"So there was this farmer and he was going broke. He starts asking around trying to get some ideas on how to make some money to support his family. He hears from multiple folks that pig farming is the way to go. So he buys some pigs, puts them all together in a pen, and waits. Months and months go by and he’s not seeing any baby pigs. He’s getting desperate, so he calls his local vet and asks for some advice. The vet tells him that he might have to try artificial insemination.  He has no idea what that means. But he doesn’t want to seem stupid so he asks the vet how he will know it worked. The vet tells him that when the pigs become pregnant they will lay down in the mud. He’s thinking about this artificial insemination thing and decides that it means the HE needs to inseminate the pigs. So he loads all female pigs up in the truck and takes them out in the woods and fucks all the pigs. He brings all the pigs back, puts them in the pen, and goes in to eat his dinner. The next morning he wakes up and looks out the window. None of the pigs are laying in the mud! Again, he loads all the pigs up in the truck, takes them out into the woods, and fucks each pig twice. He brings them back and he’s pretty tired, but he eats his dinner and goes to bed. The next morning he wakes up, looks out the window and none of the pigs are lying in the mud. He decides he’s gonna try one more time. So he loads all the pigs up in the truck, takes them out to the woods, and spends ALL DAY fucking the pigs. He brings them back and he’s exhausted. He goes right upstairs, falls into bed and passes out. The next morning he wakes up and he is still so tired he asks his wife to look out the window for him. He asks, “Are any of the pigs lying in the mud?” She replies, “No they’re all in the truck and one of them is honking the horn”"
420,c9m411u,"what do you call a man with no shins?

tony."
421,c9m49sh,"Why did the chicken cross the road? To get to the gay guys house...
Knock knock. 
Who's there?
The chicken."
422,c9m6b6p,"My grandpa told me this one, and I thought it was pretty funny. Since I can't remember it will, I just looked it up and copy/pasted it:

This guy is at a garage sale and he sees an old dog sitting there.
Above the dog, a sign reads, ""Talking dog - five dollars.""
So, the guy says to the dog; ""Can you really talk?""
""Yes,"" answers the dog.
So, the man says, ""That's amazing. So, what's your story, why are you being sold?""
""Well,"" says the dog. ""I was born in the late 18th century and kind of wandered the earth by myself for awhile. It was good, I had a few puppies her and there. Then, around 1938, I met my master.""

""Well, what happened from there?"" Asked the man.

The dog continues, ""Well, my master and I were a travelling road show until we decided to join the paratroopers to help fight the germans in the second world war.""

""You actually jumped out of the planes?"" Asked the man, very intrigued. 

""Oh yeah, me and my master,"" said the dog. ""Then the war ended and we started a small bakery together and both met some women and he raised his kids. Summer of love came and we traveled around a bit. He was old, but was cool with it all. In the 70s we got involved in politics and were advisers to the carter administration until my master retired. And now, he's selling me.""

""Wow,"" said the man. ""Hang on, I'll be back.""

So, the man walks up to the dogs owner and says, ""Man, I can't believe you have a talking dog. That's amazing.""

""Yup, it's a talking dog,"" says the man, in a bored tone.

""Well, I'll take him,"" he says, handing the man five dollars. ""But, I gotta ask; why are you selling him?""

The man looks at him stoically and replies, ""Cause he's a fucking liar."""
423,c9m8q86,"Whats blue and smells like red paint?

Blue paint. "
424,c9m96u9,"Bob had broken his leg and his buddy Mick comes over to see him.

Mick - How you doing?

Bob - Fine. Hey will you do me a favor... go upstairs and get me my slippers. My feet are fuckin freezin.

Mick goes up and sees Bob's hot 21 year old twin sisters lying on the bed.

He tells 'em - Your brother sent me up to have sex with both of you.

They say ""Prove it.""

Mick shouts ""Bob... both of them?""

Bob shouts back ""Of course!! Whats the point of fuckin one?"""
425,c9m9zk2,"I know this really great knock knock joke, but you have to start it."
426,c9ma0me,"A boy is doing science homework, and ask his father to help him with it.  The father agrees, so the boy asks what the difference between theory and reality is.  

""Well,"" says the father, ""Tell you what. Go upstairs to your sisters room. And ask her if she'd fuck Mr. Johnson next door for $1 Million.""

Perplexed, the boy bounds up the stairs, and returns a few minutes later saying that she had answered ""Yes"".

""Ok, now go ask your mother the same thing.""

Boy runs to the kitchen, and asks his mother the same question.  He returns to his father a short time later, with another ""Yes"".

""Well you see son. I theory we are sitting on $2 million.  In reality, we live with a couple of whores."""
427,c9ma4z3,"How do you kill a circus?


Go for the jugular"
428,c9mbkiz,"What's big, green, fuzzy, has four legs, and will kill you if it falls out of a tree?

A pool table"
429,c9mf8vn,"Three men are captured by a tribe of cannibals. The cannibal chief says ""you may chose the way you die, then I will use you skin for my canoe."" The first man chooses to be shot, then he is skinned. The second choose a sword, then he is skinned. The third man chooses a fork, the chief looks at him and says ""why a fork?"". The man starts stabbing himself and says ""Fuck your canoe!"""
430,c9mkzhp,"a man walks into a psychiatrist's office wearing nothing but saran wrap around his waist. the psychiatrist looks him up and down, thinks for a moment, and says ""well, I can clearly see your[e] nuts"""
431,c9n796h,"Four nuns ask the priest if they can go out with their friends drinking for a night. The priest says ok, but they must confess all their sins when they return. The next day, the nuns line up to say their sins. The first nun says ""forgive me, for I had intercourse whilst drunk"" and the priest replies:"" I forgive you, now drink from the holy fountain"" as they both drink, and the last nun starts giggling. The second nun says that she started a fight with someone whilst drunk. She is forgiven and they both drink from the fountain. Now the last nun is chuckling. Then the third nun says she gambled whilst drunk. She is forgiven and they drink from the fountain. Now the last nun is laughing. The priest turns and says ""and why is your sin so funny?"" And she replies ""I pissed in the fountain"""
432,c9lj7r1,Nicki Minaj is a great musician and *deserves* many awards.
433,c9lleuo,"how do you start a Ethiopian rave, tape a piece of bread to the ceiling.

Whats the best thing about getting head from an ethiopian chick, you'll know she's swallow

no offense to ethoipians but i found them really funny"
434,c9lmbh1,"Q: Why did jesus die on the cross?
A: Because he forgot the safe word."
435,c9lmkrb,"Three prisoners, an american, a chinese and an irish, were on the run. Hot on their heels are some policemen. The prisoners turned a bend and saw three trees, they looked at each other and hid in them three trees, one prisoner per tree. 

The policemen turned the bend too but they did not see any one of them. So one of them spotted the trees and concluded that they must be hiding in them trees, so they took a big stick and poked up the first tree.

The american was hiding in the first. But he was smart and said ""Chirp Chirp"" and whistled. ""Must be some birds"" the cops below said, and moved on to poke on the next tree.

The chinese, who spoke no english, was surprised to see a stick poking him, but he was wise and ""meowww""-ed. The cops below thought it was a cat, so they moved on to the last tree where the irish was hiding.

But the irish was smug. He knows whats up because he peeked through some branches and he was confident and he already chose his animal. So when the stick came up, he said...""MOOOOOOOO.."""
436,c9lmp8c,"what did sushi A say to Sushi B?
WASAAAABi (pronounced whats up B? )

how many tickles does it take to make an octopus laugh?
Tenticles!

i love my dry jokes :)"
437,c9lmqt9,"Norm's moth joke.
http://www.liveleak.com/view?i=8c4_1306857615"
438,c9lmr6y,ITT: Bad Latvia jokes
439,c9lmu4w,"""Do you like fishdicks?"" Yes.

""Do you like to put fishdicks in your mouth?"" Yes

""What are you? A gay fish or something?"""
440,c9lmvjm,"A skeleton walks into a bar...He says, ""Bartender...I'll have a beer and a mop."""
441,c9ln0jk,"How many police men does it take to change a lightbulb? Doesn't matter, they'll just beat the room for being black."
442,c9ln0x3,"A young boy tired from school goes up into his room upstairs. He lays in his bed, looks up to the stars, and starts to wonder... where the fuck is my roof?"
443,c9ln22j,"A priest and a rabbi are out on a boat fishing.  The priest says to the rabbi ""the fishing is terrible and I'm bored.  I wish we had a little boy to screw"".  The Rabbi says ""outta what?"""
444,c9ln2e3,"""It used to be called a jumpoline until your mom jumped on one"""
445,c9ln3ns,"Long but worth reading.

So there's a fly. He's having a normal day flying around a lake. Under the water there's a fish. The fish sees the fly and says to himself, ""You know, that fly's gonna get thirsty pretty soon and fly down to the lake to get a drink. And when he does, I'll jump up and eat him."" The fish was quite content with his plan. On the bank of the lake there's a big bear. He sees the fly and thinks to himself, ""That fly's gonna get thirsty and fly down to the water and get a drink. And when he does, I bet a fish is gonna jump up to eat the fly. And when he does I'll grab the fish and have a nice snack."" Behind the bear is a little mouse. He sees the fly and the bear and says to himself, ""I bet that fly's gonna get thirsty and fly down to the water and get a drink. And when he does, I bet a fish is gonna jump up to eat the fly. And when he does that bear is gonna eat the fish and spit the guts out behind him. Then I'll eat the guts and be a fat happy mouse."" Now behind the mouse there's a cat hiding in the tall grass. The cat sees the fly, the bear, and the mouse and says to himself, ""I bet that fly's gonna get thirsty and fly down to the water and get a drink. And when he does, I bet a fish is gonna jump up to eat the fly. And when he does that bear is gonna eat the fish and spit the guts out behind him. Then the mouse is gonna eat the guts and I'll grab the cat and have a nice dinner."" So eventually the fly gets thirsty and goes down to the water to get a drink. The fish jumps up and eats the fly. The bear grabs the fish, eats it, and spits out the guts behind him. The mouse eats the guts and gets nice and fat. Then, the cat pounces, misses the mouse and falls in the lake.

What's the moral of the story?

When the fly goes down, the pussy gets wet."
446,c9ln41j,"How much pussy does a priest get?

nun "
447,c9ln41n,"this is a translation from a danish one: 3 girls are in a bar, sitting on their bar stools, bragging about how loose they are.

 the first one says

""I can fit my whole hand in there!""

the second one says

""well, I can fit 2 hands in there!"" 

the third one smiles, and slowly slides down the bar stool."
448,c9ln5qc,"A man walks into a bar and asks for some punch. The bartender says ""All right, but you'll have to wait. There's a line"" The man looks all around, but no punch line."
449,c9ln6l5,The Aristocrats!
450,c9ln8lz,"What do you call a cow with three legs?
Tri-tip.
What do you call a cow with two legs?
Lean beef.
What do you call a cow with no legs?
Ground beef."
451,c9ln9iq,"A couple living on the French Riviera had a magnificent new beach house and had invited a number of local dignitaries for an evening dinner party. The wife wanted everything to be just perfect, so right before dinner she asked her husband to walk the beach to collect some really fresh snails. So hubby is collecting snails in a bucket when he comes upon a beautiful young woman packing up her beach chair for the day. They get to talking and before you know it, he's sitting on her front porch sharing a glass of wine. Of course one thing leads to another and the next thing you know, it's the next morning and the guy wakes up in this strange woman's bed. 

""Oh my God!"" he cried. ""My wife's party!"" He grabs his bucket of snails and races down the beach. He storms up his front yard, bursts through the front door and races up the stairs toward the master bedroom, spilling the bucket of snails as he fumbles up the steps. 

His wife meets him at the top of the stairs with her arms crossed, looking furious. ""You leave for a bucket of snails just 15 minutes before our guests arrive and and you're gone all night? Where the HELL have you been?"" 

Thinking quickly, the guy looks down at the snails on the steps behind him. Leaning down he motions to the snails with his index finger. ""Come on Guys,"" he says, curling his index finger back and forth. ""We're ALMOST there..."""
452,c9lndat,"Statistically, 9 out of 10 people enjoy gang-rape."
453,c9lndg2,"And old Billy Connolly one, he said it's a true story and I would love that.

A Scottish guy wanted to get a tattoo done. He was really patriotic, so he wanted **Scotland Forever** with a big thistle on his back. He went to a tattoo artist, only he was a foreigner, and wasn't really sure what a thistle was. So, the Scottish guy got a pen and paper and drew out his best picture of a thistle. 

""Ah! Thistle! Yes!"" says the tattoo artist. So he agrees to do the tattoo, bzzzzz, six hours later it's finished.

Somewhere in this world, there's a guy walking around with **Scotland Forever** and a big picture of a pineapple on his back.
"
