1,c9ll9x0,"A statue of a man and a statue of a woman stood looking at each other for hundreds of years out in a park. One day a wizard, feeling sorry for the statues, brought them to life for 30 minutes. Right away, the two of them ran into some nearby bushes and you could hear all kinds of strange sounds and moans from there. After a while they came back out, giggling. The wizard told them ""You have another 15 minutes left, if you want to have another go.""
The statues looked at each other and the male statue answered ""Fine, but this time you hold the pidgeon and i'll shit on it."""
2,c9ljp8y,"Sherlock Holmes and Dr Watson were going camping. They pitched their tent under the stars and went to sleep. Sometime in the middle of the night Holmes woke Watson up and said: ""Watson, look up at the sky, and tell me what you see."" Watson replied: ""I see millions and millions of stars."" Holmes said: ""And what do you deduce from that?"" Watson replied: ""Well, if there are millions of stars, and if even a few of those have planets, it’s quite likely there are some planets like Earth out there. And if there are a few planets like Earth out there, there might also be life."" And Holmes said: ""Watson, you idiot, it means that somebody stole our tent."""
3,c9llkew,"Paddy died in a fire and was burnt pretty badly. So the morgue needed someone to identify the body. His two best friends, Seamus and Sean, were sent for. Seamus went in and the mortician pulled back the sheet.

Seamus said ""Yup, he's burnt pretty bad. Roll him over"".

So the mortician rolled him over. Seamus looked and said ""Nope, it ain't Paddy.""

The mortician thought that was rather strange and then he brought Sean in to identify the body.

Sean took a look at him and said, ""Yup, he's burnt real bad, roll him over.""

The mortician rolled him over and Sean looked down and said, ""No, it ain't Paddy.""

The mortician asked, ""How can you tell?""

Sean said, ""Well, Paddy had two arseholes.""

""What? He had two arseholes?"" asked the mortician.

""Yup, everyone knew he had two arseholes. Every time we went into town, folks would say, 'Here comes Paddy with them two arseholes....'"""
4,c9ljb9q,"Two deer walk out of a gay bar. One turns and says to the other, ""I can't believe I just blew thirty bucks in there.""

EDIT: Thanks for the imaginary gold (:"
5,c9ljt20,[deleted]
6,c9lk61c,"Why do you never see black people on a cruise?
They aint fallin for that one again.


"
7,c9lm929,"A man and a woman have just finished celebrating their twentieth wedding anniversary and are heading up to bed for some twentieth anniversary maritals. 

On the way up the stairs the woman glances at the pictures of their children and thinks about how much she loves her life. Once they get to the bedroom the man turns off the light and they get down to business. 

Mid-coitus the woman realizes that in the twenty years she's been married (and the four they dated) she has *never* seen her husband fully naked. Perplexed by her realization, she uses a lull in the ploughing to turn the lamp on. 

*Click!*

The man is wearing a strap-on dildo. The two freeze, sharing a strangely intimate moment of shock and confusion. Finally the man clears his throat.

""I'll explain the toy if you explain our kids.""

*Click!* "
8,c9lj93y,"This is not the funniest joke I have ever heard but it made me laugh:

What's the difference between an Irish wedding and an Irish funeral?

One less drunk"
9,c9lmssu,[deleted]
10,c9ll7c9,"Read this on Reddit once before, so apologies to the person whose joke I stole: 

A man walks into a bar and sees a sign that says ""Cheese Sandwiches $1"" and then below that, another sign that reads ""Handjobs $2"". He looks around for the bartender but the only other person he can see is a really attractive woman, about 25 years old, with huge tits, at the end of the bar. He walks up to her and asks ""Excuse me, but are you the one who gives the handjobs?"" She replies in a sexy voice, ""Why yes, I am"". To which he immediately responds ""Well go wash your hands then, I want a sandwich"""
11,c9ljpe7,"Two Latvian look at clouds. 

One see potato. Other see impossible dream.

Is same cloud."
12,c9lmfnd,"The doc told a guy that masturbating before sex often helped men last longer during the act. The man decided, ""What the hell, I'll try it.""

He spent the rest of the day thinking about where to do it. He couldn't do it in his office. He thought about the restroom, but that was too open. He considered an alley, but figured that was too unsafe.

Finally, he realized his solution.

On his way home, he pulled his truck over on the side of the highway. He got out and crawled underneath as if he was examining the truck.

Satisfied with the privacy, he undid his pants and started to wank.

He closed his eyes and thought of his lover. As he grew closer to the big finish, he felt a quick tug at the bottom of his pants.

Not wanting to lose his mental fantasy or the orgasm, he kept his eyes shut and replied, ""What?""

He heard, ""This is the police. What's going on down there?""

The man replied, ""I'm checking out the rear axle, it's busted.""

Came the reply, ""Well, you might as well check your brakes too while you're down there because your truck rolled down the hill 5 minutes ago."" "
13,c9llsmi,"Argon walks into a bar. The bartender says ""Sorry we don't serve noble gasses here"" Argon doesn't react"
14,c9ll5r4,"How many Super Saiyans does it take to screw in a light bulb? 


FIND OUT NEXT TIME ON DRAGONBALL Z! "
15,c9ll5oy,The urge to sing The Lion Sleeps Tonight is only ever a whim away.
16,c9ll714,"Two whales walk into a bar.

The first whale says ""WHOOOOWAGPOOOOOEEEE""

The second whale says ""God damnit Frank, you're already drunk."
17,c9lk3q4,"-My grandma died on my tenth birthday. It kind of freaked me out, I mean, I still have birthday parties, I'm just more careful what I wish for now.
(Anthony Jeselnik)



-What's the difference between 365 blow jobs and a blimp? One is a good year, the other is a blimp.



-A Jewish boy walks up to his father and says ""Papa, I need fifty dollars."" The father says ""forty dollars?! I don't have thirty dollars! What do you need twenty dollars for? Here's ten dollars."" He hands the boy a five and says ""split it with your brothers."""
18,c9ljhzc,Two drums and a cymbal fell off a cliff.
19,c9lkgrx,"What did the sushi say to the bee?

*Wasabi!*

I laughed for an unhealthy amount of time when I first heard this joke."
20,c9lken5,"A pedophile, rapist and priest enter a bar.
He orders a beer.

Edit: slightly improved wording. Also this will never be correct English, get over it. "
21,c9lk866,"Lady walks onto the bus with her baby. The bus driver says ""eew! thats the ugliest baby I've ever seen!"" Lady starts to cry and heads to the back. The man sitting near her asks ""whats wrong?"" lady says, ""the bus driver just insulted me"". Man says, ""what!? you go up there and tell him off! Here, I'll hold your monkey!""
"
22,c9ljtx0,"How can you tell someones a vegan?

They fucking tell you"
23,c9lkw42,[deleted]
24,c9lmgnm,"A man walks into a bar with a gun and yells ""WHO SLEPT WITH MY WIFE! I'M GONNA KILL 'EM!""

A man calmly stands up and says, ""You ain't got enough bullets, mate."""
25,c9lkuqw,"According to [Wikipedia](http://en.wikipedia.org/wiki/World's_funniest_joke), the funniest joke ever is:

*Two hunters are out in the woods when one of them collapses. He doesn't seem to be breathing and his eyes are glazed. The other guy whips out his phone and calls the emergency services. He gasps, ""My friend is dead! What can I do?"" The operator says ""Calm down. I can help. First, let's make sure he's dead."" There is a silence, then a gun shot is heard. Back on the phone, the guy says ""OK, now what?""*"
26,c9lopxa,"A kindergarten teacher is trying to explain to her class the definition of the word ""definitely"". To make sure the students have a good understanding of the word, she asks them to use it in a sentence. The first student raised his hand and said, ""The sky is definitely blue"". The teacher said, ""Well, that isn't entirely correct, because sometimes it's grey and cloudy"". Another student says, ""Grass is definitely green."" The teacher again replies ""If grass doesn't get enough water it turns brown, so that isn't really correct either."" Finally, Billy raises his hand and asks the teacher ""Do farts have lumps?"" The teacher looked at him and said ""No...But that isn't really a question you want to ask in class discussion."" So Billy replies, ""Then I definitely just shit my pants."""
27,c9llhth,My friend recently got crushed by a pile of books. He's only got his shelf to blame
28,c9lml03,"So 3 mothers (a red headed mom, a brunette mom, and a blonde mom) are all sitting down talking about how disappointed they are in their daughters. 

The red headed mom says, ""I found whiskey in my daughter's room and I didn't even know she drank."" 

The brunette mom says, ""That's nothing. I found marijuana in my daughter's room and I didn't even know she did drugs.""

The blonde mom says, ""You're great mothers compared to me, I found condoms in my daughter's room, and I didn't even know she had a dick!"""
29,c9lkw5q,"Whats brown and sticky?

A stick"
30,c9lj92g,[deleted]
31,c9lmioy,"This joke is best told in person.

A rough and tough cowboy finishes his drink at a bar and gets up to leave. A minute later, he comes back in saying with a mean look in his eye ""I'm going to sit down and have one more drink, and if my horse isn't back where I left it, I'm gonna have to do what I done in Texas, And I really don't wanna have to do what I done back in Texas!"" 

True to his word, he sits down, orders another drink, sits in the [silent] bar and finishes his drink. He then gets up and walks outside and sure enough, his horse is back tied up where he left it. As he's just about to ride off, one of the other patrons timidly asks, ""mister?  What was it you had to do in Texas?"" The cowboy gets a far off look in his eyes and says sadly, ""I had to walk home."" 
"
32,c9lj9mg,So a family walks into a talent agency...
33,c9llo5o,"What's a pilot's favourite flavour of chips?

Plain

---------

What's the hardest part of roller skating?

Telling your parents you're gay

---------
"
34,c9lo6q7,"A Guinness brewery worker travels to the home of his co-worker with bad news. 

'I'm sorry Mary, but Keith died at the brewery today'.

'Oh my god!' replied Mary, 'What happened?!'

'He drown in a vat of Guinness Stout' said the worker, sadly.

'That's terrible! Was it a quick death at least?' asked Mary.

'I'm afraid not,' the worker replied, 'He got out twice to take a piss'."
35,c9lphar,"A store that sells new husbands has opened in New York City, where a woman may go to choose a husband. Among the instructions
at the entrance is a description of how the store operates:


You may visit this store ONLY ONCE! There are six floors and different products are offered as the shopper ascends the flights. The shopper may choose any item from a particular floor, or may choose to go up to the next floor, but you cannot go back down except to exit the building!

So, a woman goes to the Husband Store to find a husband. On the first floor the sign on the door reads:

Floor 1 - These men have good jobs

She is intrigued, but continues to the second floor, where the sign reads:

Floor 2 - These men have good jobs and are attractive.

'That's nice,' she thinks, 'but I want more.'

So she continues upward. The third floor sign reads:

Floor 3 - These men have good jobs and are attractive and love kids.

'Wow,' she thinks, but feels compelled to keep going.

She goes to the fourth floor and the sign reads:

Floor 4 - These men have good jobs and are attractive and love kids and help with the housework.

'Oh, mercy me!' she exclaims, 'I can hardly stand it!'

Still, she goes to the fifth floor and the sign reads:

Floor 5 - These men have good jobs and are attractive and love kids and help with the housework and have a strong romantic streak.

She is so tempted to stay, but she goes to the sixth floor, where the sign reads:

Floor 6 - You are visitor 31,456,012 to this floor. There are no men on this floor. This floor exists solely as proof that women are impossible to please. Thank you for shopping at the Husband Store.


PLEASE NOTE:

To avoid gender bias charges, the store's owner opened a New Wives store just across the street.

The first floor has wives that were attractive and well proportioned.

The second floor has wives that were attractive and well proportioned and love sex.

The third, fourth, fifth and sixth floors have never been visited.

**EDIT:** Slight wording change to curb the obvious sense of humour failure displayed by some who appear to have no idea why jokes exist."
36,c9ljphf,[removed]
37,c9lkvwn,"""Wenn ist das Nunstück git und Slotermeyer? Ja! Beiherhund das Oder die Flipperwaldt gersput!"""
38,c9ln15d,"This is probably the best joke I know to consistently get a laugh out of people. It has never failed me once.

>One day a small rabbit was taking a run through the forest. As he was running he came upon a giraffe. This giraffe was about to shoot up some heroin. The rabbit looked at he giraffe for a moment and then said, ""Giraffe, don't do heroin. Heroin is a drug, and drugs are bad for you. Come running with me through the forest.""
>
>The giraffe looked at the rabbit, then at the heroin, then back at the Rabbit, and then threw the needle away. The two then proceeded to run though the forest.
>
>While running through the forest they came upon a sheep. This sheep was about to smoke a joint. The rabbit looked at he sheep for a moment and then said, ""Sheep, don't smoke pot. Pot is a drug, and drugs are bad for you. Come running with us through the forest.
>
>The sheep looked at the rabbit, then at the joint, then back at the rabbit, and then threw the joint away. The three then proceeded to run through the forest.
>
>The three then stumbled upon a tiger. This tiger was about to crack open a cold beer. The rabbit looked at the tiger for a second and then said, ""Tiger, don't drink alcohol. Alcohol is a drug, and drugs are bad for you. Come running with us through the forest!""
>
>The Tiger then looked at the rabbit, then at the beer, then back at the rabbit, and then cracked open the beer and **carefully** placed it on the ground next to him. He then proceeded to slowly walk over to the rabbit, lifted his paw up, and then mauled the shit out of the rabbit. After he was done he slowly walked back to the beer, picked it up and started drinking it.
>
>The giraffe and the sheep were shocked. The giraffe looked at the tiger and said, ""Dude!!! What the fuck? He was just trying to help you!!! Why did you hurt him?""
>
>The tiger slowly looked at the giraffe and then said, ""Because every time that rabbit does cocaine I end up running through the fucking forest!!!""

Here is another

>A man is in the restroom of a bar taking a piss. He looks down to the urinal next to him and sees a short man in a green suit taking a piss. This little guy has the absolutely largest dick that the man has ever seen. The man is absolutely shocked.

>He says to the little man, ""Excuse me, but I couldn't help but notice that you have an absolutely massive dick for such a small person.""

>The little man looks up and says, ""Well of course I do, all leprechauns do!""

>The man is even more shocked now, ""Wait you're a fuckin' leprechaun?!""

>The little man responds, ""Yeah! I can even grant you one wish, but there is a catch. If you want the wish you need to let me fuck you in the ass.""

>The man thinks for a second and agrees. Who wouldn't agree? Anything you wanted for getting fucked in the ass just once. 

>So they move to a stall, the little man jumps up on the toilet, and they start fucking. The little guy really starts giving it to him. 

>After a while the little man asks, ""Oh by the way, how old are ye?""

>""35""

>""Wow 35 years old and you still be believe in leprechauns!!!"""
39,c9lj89o,[deleted]
40,c9lkpeh,"How many kids with ADHD does it take to change a light bulb?

 *Let's go play on our bikes*"
41,c9ljab2,"
What do you call a fish with no eyes?

*Fsh*"
42,c9lk7k4,"Why aren't jokes in base 8 funny? 

Because 7, 10, 11! "
43,c9lq066,"There once was a woman who got breast implants made of wood.

It would be great if this joke had a punchline...

...wooden tit."
44,c9lpajm,"A man is attending the Super Bowl, when he notices an empty seat. Thinking this to be strange, the man asks the person sitting next to the empty seat if he knows who sits there. The guy replies: Well, I bought two tickets for my wife and I a long time ago, but she passed away. So the man asks: Couldn't you have brought someone else? 

""They're all at the funeral.""

EDIT - Added clarification quotes"
45,c9lrgd4,"This is my favorite joke, it just takes a while to tell.

Three men arrive in heaven at the same time. St. Peter comes out to greet them.

""Sorry about this guys,"" says St. Peter. ""God didn't realize just how many people would get into heaven, so we have a new policy. You now have to tell me the story of how you died, and if I think it's sad or interesting enough, I'll let you in.""

He walks up to the first man who is a nerdy, bookish sort in a bad business suit and says, ""Tell me your story.""

""Okay,"" says the man. ""I thought I had a wonderful life. I had a beautiful wife and we had a lovely place on the 34th floor of an apartment building. I came home from work early today, and I saw my beautiful wife sleeping naked in bed with another man's clothes on the floor. So of course I started looking for the bastard who slept with my wife."" 

""Like I said, I lived in an apartment. There weren't that many places to hide, but I couldn't find him anywhere! Just when I was about to go confront my wife, I see him. The bastard was hiding outside the window, holding onto the windowsill. I go up to him and started stomping on his hands over and over again, but he wouldn't let go. I finally kicked him in the face and he fell. Unfortunately, he landed on a bush and bounced to safety. In my anger, I grabbed my refrigerator and throw it out after him. However, the cord from the refrigerator wrapped around my leg and pulled me to my death.""

St. Peter nods and says, ""You're story is acceptable. Welcome to heaven."" He goes to the second man a brawny working-man type and says, ""What's your story?""

""I'm a window washer,"" says the man. ""I've been a window washer for over 20 years. Well today, I'm washing the windows of the 35th floor of this apartment building when my scaffolding breaks. I thought I was going to die, but I manage to catch myself on the windowsill of the story below. All of a sudden this maniac comes out and starts mashing my fingers. I try my best to hold on, but he kicks me in the face and I fall. Once again, I thought I was going to die, but I land on this hedge and bounce away no worse for the wear. I look up and BOOM. Dead. Last thing I saw was a refrigerator.""

St. Peter holds back a chuckle and lets him into heaven. He goes to the third man, a ridiculously handsome fellow with sandy-blonde hair, and asks, ""What's your story?""

""Alright,"" says the man. ""Picture this. You just got finished banging some dude's wife. He comes home. You hide in the refrigerator."" "
46,c9ljt66,"Did you hear about the guy who lost his left side?

He was alright.

Edit: this joke may not be appropriate in light of recent events. Use to be a favorite of mine."
47,c9llg3g,I finally got round to reading that Stephen Hawking book the other day. It's about time.
48,c9llj9c,"Maybe not the funniest, but I've remembered it after all these years from the movie *Colors* in an exchange between Sean Penn and Robert Duvall...and something to live by:

>A young bull and an old bull are on top of a hill overlooking a pasture full of female cows.
>
>The Young bull looks at the old bull and says ""hey dad, lets race down there and fuck one of those cows.""
>
>The old bull looks at him and says ""no son, lets walk down there and fuck them all""."
49,c9lllj4,"Kind of long and I've also posted it on the ""go to joke"" post, but whateever.. A man and his buddies go into a bar for a night out, and upon walking in he notices a big jar full of money sitting on the counter. His buddies all find a spot, and he goes to order some drinks. When he gets to the counter, the first thing he asks the bartender is ""hey barkeep, what's that jar of money for? looks far too large to be an average tip jar."" The bartender casually cleaning out a few glasses ready for beverages gladly explains. ""Well you see, that's our prize jar. So to speak, and in that jar is 10,000 dollars cold hard cash, and you could win it all ya know"". After hearing the staggering amount of cash he could possibly obtain, the man nods for the bartender to continue. ""Well it's pretty simple really. There are three tasks you gotta accomplish. First one is you have to eat this whole jar of hot chili peppers, you can't eat or drink anything else with them either."" Thinking this could be easier than he thought, the man perks up more and listens closer. ""Second thing that you have to is go out back where our pitbull is tied up, and pull his rotten tooth."" Losing interest quickly but his curiosity getting the better of him, the man asks what the third task is. ""This last one's a kicker! Last thing you gotta do is go directly across the street to this little old ladies house, she's never been screwed in her life an you have to fuck her brains out."" Completely put off by now the man pays for the drinks and joins his buddies for a few rounds. Half an hour and several shots later, the man stumbles up to the barkeep and says ""gimme them hot peppers!"" He downs the whole jar without skipping a beat, no flinching, no sweating, no choking, nothing but the sound of peppers being mutilated. After finishing up, the noticeably impressed barkeep directs the drunk man to the back door. After he shuts the door behind the man a struggle can clearly be heard. The dog is barking and howling, the man grunting and groaning, truly a magnificent battle between man and beast is taking place. After a solid 15 minutes of struggle, there is nothing but silence with a decent sized crowd growing, watching the back door for any signs of life the man opens the door and stumbles inside, his clothes are tattered and torn, he has bruises and bites from head to toe. After a minute of catching his breath the man looks over to the bartender and says through a slightly slurred voice ""alright, now wheres that old lady that needs her tooth pulled!"" .. Hope you guys enjoy that one as much as I do!"
50,c9lmfbs,"What did one tampon say to the other.

Nothing, they're both stuck up cunts."
51,c9lmmfn,Why are Jewish men circumcised? because Jewish women won't touch anything untill it's at least 20% off
52,c9lrx9l,"My all time FAVORITE joke that has stuck with me since I was a kiddo:

Three men are shipwrecked on an island infested with cannibals. They were brought to the cannibal king who tells the three men that they must complete a series of tests so that they will not be eaten. The first task, he tells them to bring back 10 pieces of the same fruit. So they go out to scavenger the island. 

The first man brings back apples and is told for the next task, he must shove all 10 up his butt without a noise or emotion. He gets one and a half up there before he screams and gets killed and eaten. 

The second man comes back with 10 berries and told of the same task. As he is about to get the 10th and final berry in, he bursts out in laughter and gets killed and eaten. Up in heaven the first man meets the second man and asked why he laughed since he was so close to freedom. He replied, ""I couldn't help it, I saw the other guy walk in with pineapples."" "
53,c9lmbvu,"A man comes home from work to find his girlfriend moving out of the house. ""Where the hell ya think you are going?"" the man asked.""I am leaving you because I heard you are a pedophile"" replied the girlfriend. The man pauses for a second and then says"" pedophile ehh? That's a pretty big word for a 10 year old"""
54,c9lmda6,"My two favortes:

what do you call a black guy who flies a plane? A pilot, you racist!

How does every black joke start? ::looks around over both shoulders::"
55,c9lkvnv,"Why do they call helium, curium and barium the medical elements? Because if you can't helium or curium, you barium!"
56,c9ll999,"So my dog, Minton, ate a shuttlecock last night.




Bad,minton."
57,c9lk91i,"The chief sat with his youngest son. The son asks his father what's this with the names he gave his children.
""Well, I give you names from what I see at the moment of your births, to mark that moment. Your eldest brother Rising Sun was born at the first light in the morning, and your other brother Lighting was born when a storm was coming up. But why do you ask, Two Fucking Dogs?"""
58,c9lmj3p,"Man goes to doctor. Says he's depressed. Says life is harsh and cruel. Says he feels all alone in a threatening world. Doctor says, ""Treatment is simple. The great clown Pagliacci is in town tonight. Go see him. That should pick you up."" Man bursts into tears. Says, ""But doctor... I am Pagliacci."" Good joke. Everybody laugh. Roll on snare drum. Curtains. "
59,c9lk1hm,How do you start a rave in Ethiopia? you tie a bit of bread to the ceiling.
60,c9lk5h0,"How did the koala fall out of the tree?

It got shot.

How did the second koala fall out of the tree?

It got hit by the first koala.

How did the third koala fall out of the tree?

It thought it was a game.

How did Bill fall off his bike?

He got hit by falling koalas."
