179,c9ls7ct,"What do you call a woman with one leg?

Ilene.

What do you call an Asian woman with one leg?

Irene."
180,c9lse6z,TIL reddit doesn't know what a funny joke is
181,c9lsuby,"Canada's worst air disaster occurred today when a small two-seater Cessna plane crashed into a cemetery early this afternoon in central Newfoundland.

Newfie search and rescue workers have recovered 826 bodies so far and expect that number to climb as digging continues into the evening."
182,c9lt98y,"See, I was trying to remember who Rihanna was dating, but it just wasn't happening.

Then it hit me."
183,c9ltay4,"A Scotsman is visiting America for the first time, and goes to a baseball game with his friend. As the game is being played, the American friend is gradually explaining the rules. A batter is struck out, and returns to the dugout. The Scotsman asks why, to which the American friend says, ""He missed three good pitches, so he's out."" The next batter comes up, and gets a 3-2 count. The pitcher throws another ball, and the batter begins to walk to first. Confused, the Scotsman asks why he's walking. The American friend says, ""Well, he has 4 balls, so he gets to walk to first."" The Scotsman stands up and proclaims, ""WALK PROUD, LADDY, WALK PROUD."""
184,c9ltgxt,"Three nuns went to the market. 

One of them asked the merchant, ""how much are these eggplants?"". 

The merchant replies, ""$3 for 4 pieces"".

The nun said, ""That's fine. We'll just cook the extra one.""
"
185,c9lva1q,"Three blondes are sitting on bar stools, one comments 'I am so loose I can fit a fist!' The second one scoffs an replies ' I am so loose I can fit two!' The third does not reply, but simply starts to slide down the barstool."
186,c9lvcx3,"Why was six afraid of seven?

Because seven is a registered six-offender."
187,c9lvg8k,"As a young boy young boy, Johnny was completely obsessed with tractors. He had pictures of tractors all over his bedroom walls; he had tractor toys,tractor T-shirts, a tractor carpet, and duvet cover, the whole works. He ate, drank and slept tractors. 

On his 17th birthday Johnny was thrilled to get an invitation to go to a tractor factory nearby and test-drive a brand new tractor. His excitement was incredible as he told his family and friends. 

The great day came and Johhny went to the factory for the test-drive. Boy was he excited! Unfortunately something went terribly wrong with the tractor when Johnny was driving it and it flipped over, trapping and breaking Johnny's leg and fracturing his skull. 

He was so upset and tried to sue the tractor company for negligence. The company however would have none of it and told him there was no liability and he could get lost! 

You can imagine he was rather pissed off with tractors after this and vowed to shed them from his life completely and forever. 

All the posters came down, the toys were given away - tractors were GONE. 

Many years later, Johnny went into a bar for a drink. Inside, the cigarette and cigar smoke was terrible, but  through it he saw an amazingly beautiful girl seated at the bar on her own. Tears were streaming down her face. 

Johnny went up to her and asked her what was the matter. The girl said that the smoke was making her eyes sting and stream with tears. 

With that, Johnny looked around and then took a huge breath, sucking in all the smoke. He then walked outside into the car park and blew all the smoke out again. 

He went back into the bar where the air was now clear and sweet and sits down next to the girl. 

""That was amazing!"" she said, ""How did you do that?"" 

""No problem"", said Johnny, ""I'm an extractor fan"""
188,c9lw9la,"A drunk Irishman walks into a library.  Walks up to the librarian and drunkenly shouts ""I'D LIKE SOME FISH AND CHIPS PLEASE!'

The librarian looks up at him, annoyed, and says ""sir, this is a LIBRARY""

The drunk Irishman, surprised, straightens up and says ""OH!  sorry sorry... 

And then quietly whispers:  
""I'd like some fish and chips please""


 "
189,c9lwh2w,"This guy goes to a bar. He sits down at the bar and looks around and notices that there are only guys in the bar, so calls the bartender over and says, ""Hey man, where are all the women? I'm looking for a little action."" The bartender doesn't even look up from wiping down a glass and says, ""Well... we don't have any women around here. All we have is Jerry. But you can fuck him if you want."" The guy is a little shocked, ""Hey! I'm not going to fuck a guy, I'm not into that type of shit!"" The bartender just shrugs and goes about his business. 

After a couple of hours and a few pitchers of beer the guy calls the bartender over again and says, ""Hey man, I've been thinking about it. Who would have to know right? Just me, you and Jerry."" The bartender looks at him and says, ""Well, just me, you, Jerry, Bill and Frank."" The guy shouts, ""WHAT?! WHO THE FUCK ARE BILL AND FRANK?!"" And the bartender replies, ""Those are the guys who hold Jerry down. He's not into that shit either."""
190,c9lxrn5,"guy gets on an elevator. just he and another woman, door closes. He says ""excuse me ma'am, can I smell your pussy"". She says ""why no"". he says ""oh, it must be your feet then"".
"
191,c9ly4ma,NICE TRY CARLOS MENCIA.
192,c9lyfxg,What kind of pants does Mario wear?.... Denim denim denim. 
193,c9lz5jw,"What's the difference between Jack Daniels and General Custer?
Jack Daniels is still killing indians"
194,c9m4jb2,An irishman walks out of a bar.
195,c9ljfkm,"I used to have a joke about a blacksmith and a farrier, an old timey one that I am nearly certain I thought of myself but admit I may have overheard or read it somewhere.

It made me laugh so hard I hurt my sides whenever I thought of it. I told this joke to no less than 2 dozen people, and no one got it (thanks to knowing nothing about blacksmithing or shoeing horses), and stopped telling it. Eventually I forgot it, and am left now with only a memory of a memory of a joke whose loss saddens me terribly.

... but here is a pair of jokes, nowhere near as funny (of course), and I probably have better ones if I thought about it.

Did you hear about the guy who overdosed on viagra?
His wife died.

If tylenol is acetaminophen, and advil is ibuprofen, what is viagra?
Mycoxafalin."
196,c9llmuk,"Three friends of different professions go out for dinner. Near the end of their meal the first friends tells the others ""You know what's funny I'm an insect biologist and I drive a VW Beetle."" The second friend says ""That's pretty good but I'm an astronomer and I drive a Saturn.""  The third friend says ""I have you both beat because I'm a proctologist and I drive a brown Probe."""
197,c9llotv,"One day a man walks into a bar and to his amazement, he finds a tiny person playing a tiny piano. Stunned the man asked the bartender where he got the person. The bartender replied that if you go into the closet there is a genie that will grant one wish. The man dashed into the the closet and as the bartender said their was a genie. The man wished for 1,000,000 million bucks, but instead, got 1,000,000 ducks. Infuriated the man stormed to the bartender and screamed ""I asked your fucking genie for 1,000,000 bucks but i got 1,000,000 ducks. ""No duh"", replied the bartender, ""Do you really think I asked for a 12 inch PIANIST"
198,c9llzoj,Do you like fishsticks?
199,c9lmb0s,"What did Cinderella do when she got to the ball?




Gag."
200,c9lmzrx,"How many cops does it take to change a light bulb? None, they just beat the room for being black."
201,c9ln7dy,"Helium walks into a bar. The barman says ""Sorry, we don't serve noble gases in here"". Helium doesn't react."
202,c9lna4p,"This is a racist joke that my white friend told my black friend (cool guy, he's fine with jokes). So we're all hanging out at a restaurant getting ready to leave when black friend needs to use the bathroom. So we're waiting for him to finish, and he is taking forever. Finally, white friend walks in to make sure he's okay, black friend is okay, just taking massive shits. So white friend says ""Okay, well we really need to hurry up so if you could just take 3/5 of a shit, that'd be great"" and black friend just busts out laughing shouting ""YOU SON OF A BITCH!""

We still all laugh at that joke to this day... We're going to hell"
203,c9lnfbu,"Two bros graduated college and went their separate ways but always met for happy hour a few times a year to catch up. One got married and had kids; the other stayed single and dated lots of beautiful women. The former always really enjoyed hearing about the latter's sexual escapades. So one day over a whiskey, our bachelor is regaling our dad with a story about a date he had with a beautiful woman who had perfect, perky tits which were barely held back by a tight pink sweater. He said ""I shit you not they were so perfect that all I could do was stare and it was getting obvious and awkward. She kept catching me checking out the goods. I was so nervous that when I asked her to pass the bread, I actually said 'could you please pass your breast!' It was mortifying."" The dad replies "" I know exactly what you mean! Just this morning I was having breakfast with my wife and I meant to say 'Could you please pass the Post Toasties?' but instead I said 'You ruined my life, you fucking bitch!"""
204,c9lnpe8,[deleted]
205,c9lnqbu,Michelle Bachmann.
206,c9loar7,"A little boy just saw his mother naked and runs to his father asking, ""what is that between mommy's legs?"" The father relies, ""that's a vagina"". Confused, the boy then asks, ""well... then what's a cunt?"" The father answers, ""that's the rest of your mother."""
207,c9lorpc,"A woman gets on a bus with her baby. The bus driver says: ""That's the ugliest baby that I've ever seen. Ugh!"" The woman goes to the rear of the bus and sits down, fuming. She says to a man next to her: ""The driver just insulted me!"" The man says: ""You go right up there and tell him off – go ahead, I'll hold your monkey for you."""
208,c9lp0sc,"What's the hardest part about being a pedophile?

Fitting in. "
209,c9lp352,"Did you guys hear about 9/11?
National bring you plane to work day."
210,c9lp8cy,"Little Johnny raises his hand in the back of Mrs. Anderson's 3rd grade classroom.  ""Yes Johnny"".  ""Teacher, I gotta take a piss.""  ""Johnny, we don't use that language.  The proper word is urinate.""  Johnny rolls his eyes, bouncing in his seat, really needing to go.  ""Billy you can go once you use it in a sentence.""  Johnny thinks for a second.  ""Mrs. Anderson, urinate.  But if your tits were bigger you'd be a ten."""
211,c9lqzva,"What's blue and smells like red paint?
Blue paint"
212,c9lrgjw,"What's brown and rhymes with ""Snoop?""

Dr. Dre."
213,c9lru16,"A duck walks into a bar and asks the barman ""Got any bread?""
""No, sorry pal, we're all out of bread."" replies the barman.
""Got any bread?"" Enquires the duck again
""No, I just said we're all out mate."" the barman insists.
""Got any bread?"" the duck continues
""Look, if you ask me for bread one more time I'm gonna nail your beak to this bar"" the now irate barman yells.
""Got any nails?""
""Um...no.""
""Got any bread?"""
214,c9lsikr,"Pete the pirate walks into a bar. The barman says, ""Jaysus Pete I havent seen you for a while, how are things?"" and then he notices some changes. ""Pete, what happened you leg?"" Pete says, ""Arrgh I was sailin the seven seas and one day we were attacking a ship when a cannon ball blew my leg clean off. But I have this wooden leg now and it works great so I hardly even notice it missing"". ""But Pete, what happened your hand"" says the barman. ""Arrgh"" says Pete, ""one day we were attacking another ship and we got into a sword fight and someone chopped my arm clean off, but I have this hook now and its actually very useful."" Then the barman says, ""Pete what happened your eye?"" referring to the eyepatch. ""Arrgh"" says Pete, ""One day we were sailing along and a flock of seagulls passed overhead and as I was looking up at them, one shit right into my eye"". ""Holy crap"" said the barman, ""it must have been a huge seagull"". No said Pete, ""It was the day after I got my hook!"""
215,c9lsvk9,"How many emo kids does it take to change a lightbulb?

-none, they just sit in the dark and cry"
216,c9ltpbq,"My friend came up with this one back in middle school...

So a guy walks into a gas station and goes into the bathroom. He comes out about 20 minutes later and the gas station attendant says, ""Jeesh what were you doing in there for so long?"" The guy says, ""I was blowing bubbles."" Later, another man goes into the bathroom and is in there for 30 minutes. When he comes out the attendant says, ""And what were YOU doing in there for so long?!"" The man says, ""I was blowing bubbles."" A few minutes later a man who the attendant had never seen before comes out of the bathroom. The attendant says, ""Now who the hell are you?"" The man says, ""I'm Bubbles."""
217,c9ltu7h,"An old couple are trying their best, but despite their efforts, the old man can't get his wife to have an orgasm. So they go to a sex therapist, who prescribes that they hire a strapping young man to wave a towel in front of the wife's eyes while the old man makes love to her from behind the towel. 

They hire a male prostitute and try the therapists advice, but still no orgasm. The old man angrily grabs the towel and says ""I'll wave the towel, and you make love to my wife!"" This time around, the man's wife has an incredible orgasm.

The old man looks at the young man and says: ""Shmuck, that's how you wave a damn towel!"""
218,c9lu1pu,"An Englishman, a Scotsman, and an Irishman are driving together to work and die in an accident. When they arrive at the gates of heaven St. Peter decides to give them a second chance. He says to the Englishman, ""You can never think about money anymore."" He says to the Irishman, ""You can never think about beer anymore."" Finally he says to the Scotsman, You can never think about sex anymore."" So all three are now walking to work when the Irishman looks into a bar window and says I'd kill for a....poof the Irishman is gone. The Englishman and the Scot are looking at eachother confused and scared. The Englishman walks on ahead to pick up a pound note and poof! The Scotsman is gone."
219,c9lu2wq,"Why did Sally fall off the swing? 

Because she has no arms.


Knock knock

Who's there?

Not Sally."
220,c9lu8iy,"Two elderly couples were having a dinner party.

After finishing the ladies went in to the kitchen leaving their husbands to talk.

One of the men started describing the fantastic meal they had recently had at a restaurant. The other man asked him for the name of the establishment.

The first man asked him ""What's the name of that flower that's usually red and has thorns?""

The second guy replies ""a rose?""

First guy says ""that's it"", then screams towards the kitchen ""Rose, what's the name of that restaurant we went to the other night!"""
221,c9luo30,Women's rights
222,c9lva40,"Statistically, 6 out of 7 dwarves aren't Happy."
223,c9lvdxf,"There's a white girl dating a black guy and they're both at a party. The girl gets drunk, so the guy brings her back to her house. When she's at the door, she says to him, ""Why don't you show me if what they say about black guys is true?"" So he stabs her and takes her purse"
224,c9lvmes,You gotta treat McDonalds like your wife's vagina. Show it some respect and only eat it when you're on vacation. 
225,c9lvr0x,"Jesus was walking along one day, when He came upon a group of people surrounding a lady of ill repute. It was obvious that the crowd was preparing to stone her, so Jesus made His now-famous statement, ""Let the person who has no sin cast the first stone.""

The crowd was shamed and one by one began to turn away. All of a sudden, a lovely little woman made her way through the crowd. Finally getting to the front, she tossed a pebble towards the woman.

Jesus looks over and says, ""I really hate it when you do that, Mom."""
226,c9lwdm1,"A blonde and a brunette where talking. The blonde complained to the brunette that her boyfriend has terrible dandruff.

The brunette says: ""When my boyfriend had dandruff, I gave him Head & Shoulders.""
The blonde, looking perplexed, asks: ""How do you give shoulders?"""
227,c9lxmg0,"This was about 4 years ago now.

At a rental home we moved into for 7 months while we built our new home was pretty shitty. It was directly across the street from our old home, and was pretty much the only option. While scrounging around the place (It was a 50 some-odd year-old home) I found a laptop case with a laptop in it, it was a [Toshiba T-1910](http://acagle.net/images/ToshibaT1910.jpg) It was a pretty heavy rig, I brought it back to my room, and turned it on. It loaded at a decent rate, and was surprisingly well-taken care of and in overall good shape, no glitches (It had Linux on it, I think) I began exploring the files, played a game or two, and launched the ""emails"" folder. There were hundreds! These things dated back to about 1987-1990, and all addressed to this person who was pregnant at the time (All the emails in there were regarding the child, baby shower stuff, where to go to school, possible abortion, etc), and she was receiving these joke emails daily from the same guy that contained one joke each. One of the ones that stood out to me was this:

""...*A lady was driving down a country road, doing the speed limit, and was enjoying the drive, suddenly, a rabbit jumps out in front of the car, she has no time to react, and hits the rabbit killing it instantly. Absolutely horrified that she just killed a rabbit, she pulls over, and cries in her car. About 5 minutes later, a priest happens to drive by, notices her, and stops. He comes to her window, and asks ""My dear child, why are you crying?"" The lady responds through her sobs: ""I hit a rabbit!"". The priest says not a word, and proceeds back to his car, opens the back, grabs a spray can, and walks over to the rabbit. The lady, now out of her car, is watching the priest spray the rabbit with the can. Some time passes and the rabbit springs back to life, dusts itself off, and runs for about 50 feet, stops, and waves. The rabbit repeats this until they can no longer see the rabbit. The lady, now awestruck, ask the priest in a shaky voice: ""What did you do? What is in that can?"" The priest hands her the can, and the lady reads aloud: ""... Super Hair, will bring any hair back to life and adds permanent wave."".*


**TL;DR: Found mysterious laptop, found really old, and funny emails on it.**

"
228,c9m1t0c,"A camper, having been lost in the woods for days, miraculously stumbles onto a ranch and is quickly taken in by the hospitable owner. As they walk into the main house, the owner tells the camper ""You know, I built this house with my own two hands, but no one calls me Tom the House Builder."" The camper thought this was a bit odd to say, but, grateful for the hospitality, he just nodded his head and followed the owner into the house. The owner set about making the camper as comfortable as possible, sitting him at the kitchen table and placing a warm stew in front of him. ""You know, I made this soup myself, but no one calls me Tom the Soup Maker."" The camper was again unsure of how to respond, so he just smiled and ate big spoonfuls of the stew. The owner of the ranch knocked on the table with his hand and said ""You know, I crafted this table all on my own, but no one calls me Tom the Table Crafter."" He paused for a moment, looking down and shaking his head. ""But you fuck one goat..."""
229,c9m1umw,Oh my god this thread is so awesome when your high and shit faced drunk.
230,c9m2jjd,"This one is racially offensive I learned it at boot camp from a Hispanic friend, if you will get offended fuck of.

Why does Mexico’s Olympic team suck?

Because all the Mexicans that can run jump and swim are already in the USA.

Its ok I’m Mexican
"
231,c9m4ivs,"This chick is trying to get me fired for ""giving her inappropriate massages in the work place."" Well I say good luck with that sweetheart, I don't even work here."
232,c9lj8fh,"already done:

http://www.youtube.com/watch?v=8gpjk_MaCGM

and you can't handle it"
233,c9lk9ku,ITT:  A lot of really dumb jokes.
234,c9lmfnx,"What do you call an Irishman who sits on the porch?

Patio furniture. (Paddy O' Furniture)"
235,c9lmoqj,"For nearly every joke here...

http://imgur.com/c1viHUg"
236,c9lmsji,Where do you find trees in Minnesota? In between the twos and the fours. A joke by Garrison Keillor
237,c9loz0i,Why did the monkey fall out of the tree?  Because it was dead.
238,c9lpnge,"Why was Helen Keller such a bad driver?

She as a woman"
239,c9lpotn,"My job is so fucking unbelievable. I'll try to sum it up by first telling you about the folks I work with: First, there is this supermodel wanna-be chick. Yeah, okay, she is pretty hot, but damn is she completely useless. The girl is constantly fixing her hair or putting on makeup. She is extremely self-centered and has never once considered the needs or wants of anyone but herself. She is as dumb as a box of rocks, and I still find it surprising that she has enough brain power to continue to breathe. The next chick is completely the opposite. She might even be one of the smartest people on the planet. Her career opportunities are endless, and yet she is here with us. She is a zero on a scale of 1 to 10. I'm not sure she even showers, much less shaves her ""womanly"" parts. I think she might be a lesbian, because every time we drive by the hardware store, she moans like a cat in heat. But the jewel of the crowd has got to be the fucking stoner. And this guy is more than just your average pothead. In fact, he is baked before he comes to work, during work, and I'm sure after work. He probably hasn't been sober anytime in the last ten years, and he's only 22. He dresses like a beatnik throwback from the 1960's, and to make things worse, he brings his big fucking dog to work. Every fucking day I have to look at this huge Great Dane walk around half-stoned from the second-hand smoke. Hell, sometimes I even think it's trying to talk with its constant bellowing. Also, both of them are constantly hungry, requiring multiple stops to McDonalds and Burger King, every single fucking day. Anyway, I drive these fucktards around in my van and we solve mysteries and shit"
240,c9lpuml,Wenn ist das Nunstück git und Slotermeyer? Ja! Beiherhund das Oder die Flipperwaldt gersput!
241,c9lpwv8,"Two of my friends used to have a radio show in college, and they started reading stupid jokes off a website. Now, they read these sight-unseen, so occasionally they wouldn't get them, and those were the best. For example: 

What was Beethoven's favorite fruit?

The correct answer is Ba-Na-Na-Nas, read like the well-known music associated with him. However, my friend just goes ""What is Beethoven's favorite fruit. Bananas! Ok...moving on..."""
242,c9lq37q,"**Q:** Why do cows wear bells?

**A:** *Because their horns don't work.*"
243,c9lqvat,"A long-haul truck driver is driving through the deep south, hauling a load of bowling balls.  As he's driving he sees two little African American kids walking their bikes, it looks like they have flat tires.  The kids wave him down and beg him to drive them home.  He agrees to do so, but tells them they have to ride in the back with the bowling balls.  So the kids load up their bikes and hop in back.

A few miles down the road a state trooper pulls over the truck driver and starts hassling him about how fast he was driving.  The trooper asks to inspect the driver's cargo. 

He opens up the big cargo doors and immediately screams into his radio, ""I need back up, I need back up!  This guy's haulin' a load of nigger eggs, two already hatched and stole bicycles!"" 

"
244,c9lqwgl,What's the difference between jelly and jam? I can't jelly my dick down your throat... 
245,c9lrde6,"A baby polar bear goes to his parents and tells them, ""mom, dad, I don't think I'm a polar bear."" mom says well I'm a polar bear and grandma and grandpa are polar bears. Dad says and I'm a polar bear and my parents are polar bears. Why dont you think you're a polar bear? He says ""because i'm fucking cold!"" "
